{
  "schemaVersion": 2,
  "subject": "生物学",
  "version": "2.4.0",
  "lessonCount": 24,
  "lessons": [
    {
      "topicId": "ct_sw_g7a_01",
      "summary": "从营养呼吸排废物认全生物的共同特征，再看光温水怎样左右生物的生活与分布",
      "explanation": [
        "判断一个物体是不是生物，不能只看会不会动、能不能长大：岩洞里的钟乳石能慢慢长大，却不是生物；机器人会演奏乐曲、能踢足球，也不是生物。生物的共同特征是：生物的生活需要营养；生物能进行呼吸；生物能排出身体内产生的废物；生物能对外界刺激作出反应；生物能生长和繁殖；生物都有遗传和变异的特性；除病毒以外，生物都是由细胞构成的。这些特征合在一起，才是判断生物的完整依据。",
        "这些特征在生活里随处可见。绿色植物从外界吸收水、无机盐和二氧化碳，通过光合作用自己制造葡萄糖、淀粉等有机物，等于自带厨房；动物不能自己制造有机物，要以植物或别的动物为食。人靠排尿、出汗和呼出气体把体内废物排出去；猎豹发现猎物迅速追击、含羞草被碰一碰叶片就合拢，都是对刺激作出的反应。种子萌发并长成幼苗是生长和繁殖，鳄类产卵、虎和狼产仔也是繁殖；同一窝小狗长得像妈妈是遗传，彼此又总有些不一样是变异。",
        "怎么判断某个物体是不是生物？可以逐条对照：它需要营养吗？能呼吸吗？能排出废物吗？对刺激有反应吗？能生长繁殖吗？有遗传变异吗？由细胞构成吗（病毒除外）？符合这些生命现象的才是生物。再看环境这一侧：环境中影响生物的生活和分布的因素叫做生态因素，分为两类——非生物因素，即光、温度、水等；生物因素，即影响某种生物生活的其他生物。遇到一个因素先问一句它是不是生物，就能准确归类。",
        "几个易混点要辨清。能运动不等于生物：机器人、汽车都会动，却不需要营养、不能繁殖；不能运动也不等于非生物：树木花草不移动位置，却是生物。能长大也不一定是生物：钟乳石是矿物质一点点堆积变大的，不吸收营养、不能呼吸繁殖。还要分清遗传和变异：子代与亲代之间表现出相同的特征是遗传，子代与亲代之间以及个体之间存在差异是变异。生物与环境的关系也有两个方向：荒漠中的骆驼刺根系非常发达、寒冷海域的海豹皮下脂肪很厚、炎热缺水的骆驼尿液非常少，都是适应环境；蚯蚓在土壤中活动使土壤疏松，则是影响和改变环境。",
        "生物都生活在一定的环境中，环境影响生物，生物也适应并改变环境，生物与环境的相互作用共同造就了欣欣向荣的生物圈。沿着这条线索往后学，就会把生物和它们的环境合起来看成统一的整体——生态系统，再看到整个生物圈这个最大的家园。理解了生物与环境相互依存，也就理解了为什么要爱护身边的一草一木。"
      ],
      "methods": [
        {
          "name": "生物特征逐条对照法",
          "steps": [
            "第一问：它需要不断从外界获得营养物质吗？",
            "第二问：它能进行呼吸（绝大多数生物吸入氧气、呼出二氧化碳）吗？",
            "第三问：它能排出身体内产生的废物吗？",
            "第四问：它能对外界刺激作出反应吗？",
            "第五问：它能由小长大并繁殖下一代吗？",
            "第六问：它有遗传和变异的表现吗？",
            "第七问：它是否由细胞构成（病毒除外）？多数项目成立才是生物"
          ],
          "tip": "需营养、能呼吸、排废物，有反应、能生长、会繁殖，遗传变异，细胞构成"
        },
        {
          "name": "生态因素二分归类法",
          "steps": [
            "找出影响这种生物生活或分布的具体因素",
            "判断这个因素本身是不是生物",
            "不是生物的归入非生物因素：光、温度、水等",
            "是其他生物的归入生物因素：如捕食、竞争、合作、寄生等关系"
          ],
          "tip": "先问一句：这个因素是活的吗"
        }
      ],
      "examples": [
        {
          "question": "珊瑚虫口周围长着许多小触手，用来捕获海洋中的微小生物，大多群居生活；虫体一代代死去后，它们分泌的外壳堆积在一起，慢慢形成千姿百态的珊瑚。珊瑚和珊瑚虫都是生物吗？请说明理由。",
          "solution": "珊瑚虫是生物：它能捕食获取营养、能生长繁殖、由细胞构成，具有生物的共同特征。珊瑚不是生物：它由珊瑚虫分泌的外壳堆积而成，没有生命现象，不能呼吸、不能繁殖，只是非生物。",
          "difficulty": 2,
          "pitfall": "只看到珊瑚能慢慢长大就当成生物——它的长大是外壳堆积，不吸收营养，不是生物的生长。"
        },
        {
          "question": "高山上阔叶林往往分布在海拔较低的地方，针叶林往往分布在海拔较高的地方；沙漠上到处都是不毛之地，只有靠近水源的地方出现绿洲。这两个例子分别说明哪种非生物因素的影响？",
          "solution": "前者说明温度的影响：海拔越高温度越低，不同植物适应的温度不同，分布就不同；后者说明水的影响：沙漠缺水，植物只能分布在靠近水源的地方。温度和水都属于非生物因素。",
          "difficulty": 1,
          "pitfall": "把影响植物分布的原因答成生物因素——阳光、温度、水这类环境条件是非生物因素。"
        }
      ],
      "mistakes": [
        "能运动的物体不一定是生物：机器人、汽车都能动，却不能营养、呼吸和繁殖；树木花草不能移动位置，却是生物。",
        "能长大不一定是生物：钟乳石靠矿物质堆积慢慢变大，不需要营养、不能呼吸繁殖，不是生物。",
        "遗传和变异不要混：子代与亲代相似是遗传，子代与亲代之间、个体之间存在差异是变异，连母十个样说的是变异。",
        "生态因素不只是生物生活的地点：它是环境中影响生物生活和分布的因素，包括光温度水等非生物因素和其他生物这类生物因素。"
      ],
      "source": {
        "unit": "第一单元 生物和生物圈",
        "pages": [
          3,
          18
        ],
        "alignedAt": "2026-10-30"
      },
      "exercises": [
        {
          "kind": "textbook",
          "question": "谚语「一猪生九仔，连母十个样」，这句话描述的是生物的遗传现象吗？请判断并说明理由。",
          "answer": "不是，这句话描述的是变异现象。",
          "solution": "连母十个样，说明同一窝小猪与母猪之间、小猪彼此之间都不完全相同，这种亲子之间以及个体之间的差异属于变异；遗传指的是子代与亲代之间在很多方面表现出相同的特征。",
          "difficulty": 1,
          "source": {
            "label": "人教版七上 P8·练习T1（一猪生九仔连母十个样判断遗传还是变异）"
          }
        },
        {
          "kind": "textbook",
          "question": "珊瑚虫身体微小，能捕获海洋中的微小生物，与藻类植物生活在一起；虫体死去后分泌的外壳堆积成珊瑚。珊瑚和珊瑚虫都是生物吗？珊瑚虫一般生长在温暖的浅水区，这是为什么？",
          "answer": "珊瑚虫是生物，珊瑚不是生物；温暖的浅水区阳光充足、水温适宜，适于与珊瑚虫生活在一起的藻类生存，藻类给珊瑚虫提供氧气，双方相互有利，所以珊瑚虫多生长在温暖的浅水区。",
          "solution": "珊瑚虫能捕食、能生长繁殖、由细胞构成，具有生物的共同特征，是生物；珊瑚由珊瑚虫分泌的外壳堆积而成，没有生命现象，不是生物。藻类植物需要阳光和温暖的环境才能生存，它们从珊瑚虫排出的废物中获取营养物质，同时给珊瑚虫提供氧气，因此温暖的浅水区有利于珊瑚虫生存。",
          "difficulty": 2,
          "source": {
            "label": "人教版七上 P8·练习T3（珊瑚与珊瑚虫是不是生物）"
          }
        },
        {
          "kind": "variant",
          "question": "判断下列事例各属于生物对环境的适应还是生物对环境的影响：①荒漠中的骆驼刺根系非常发达；②蚯蚓在土壤中活动使土壤疏松；③生活在寒冷海域的海豹皮下脂肪很厚；④炎热缺水的荒漠中的骆驼尿液非常少，体温升高到40.7℃时才出汗。",
          "answer": "①③④属于生物对环境的适应，②属于生物对环境的影响。",
          "solution": "骆驼刺根系发达利于吸收土壤深处的水分，海豹厚厚的皮下脂肪利于保温，骆驼少排尿、体温升高到40.7℃才出汗以减少水分散失，这些都是生物适应缺水或寒冷环境的表现；蚯蚓的活动使土壤疏松，改变了土壤环境，属于生物对环境的影响。",
          "difficulty": 2,
          "source": {
            "label": "人教版七上 P17·正文（生物适应和影响环境的实例）变式"
          }
        },
        {
          "kind": "extension",
          "question": "有同学想探究温度会不会影响金鱼的呼吸频率（每分钟内鳃盖张合的次数）。请帮他设计简要方案：实验的变量是什么？哪些条件必须保持相同？每种水温下为什么要用多只金鱼并多次计数取平均值？如果观察到不同水温下金鱼的呼吸频率明显不同，能得出什么结论？",
          "answer": "变量是水温；水量、水质、金鱼的数目和大小等条件都要相同；用多只金鱼并取平均值是为了排除偶然因素的影响；结论是温度会影响金鱼的呼吸。",
          "solution": "对照实验要求除了要探究的条件不同以外，其他条件都相同，所以变量是水温，可设置几种不同水温的环境，而水量、水质、金鱼数量与个体状况保持一致；单只金鱼一次计数容易受偶然因素干扰，多只多次取平均值结果更可靠；不同水温下呼吸频率明显不同，说明温度这一非生物因素影响金鱼的生活。",
          "difficulty": 3
        }
      ]
    },
    {
      "topicId": "ct_sw_g7a_02",
      "summary": "生态系统分生物与非生物两部分，吃与被吃连成食物链，自动调节能力有限",
      "explanation": [
        "在一定的空间范围内，生物与环境所形成的统一的整体叫做生态系统。一片森林、一片草原、一块农田、一个湖泊、一条河流，都可以看做一个个生态系统。生态系统的组成包括生物部分和非生物部分：植物能够通过光合作用制造有机物，有机物中储存着来自阳光的能量，植物制造的有机物不仅供给自身，也是动物的食物来源，因此植物是生产者；动物不能自己制造有机物，直接或间接地以植物为食，叫做消费者；细菌和真菌能把有机物分解成无机物，供植物重新利用，常常被称为分解者。除了生物部分，还有阳光、空气和水等非生物部分。生产者、消费者和分解者之间是相互依存、相互制约的关系。",
        "可以把生态系统想成一个协作组织：植物是厨房，用阳光当炉火，把无机物加工成储存着能量的有机物；动物是食客，直接或间接地吃植物，随着摄食，食物中的物质和能量就流入动物体内；细菌和真菌是清洁队，把落叶、遗体分解成无机物归还给植物再利用，一片草原、一口池塘就这样循环运转。而把地球上所有的生物与其环境的总和合起来看，就是生物圈——生物圈是一个统一的整体，是地球上最大的生态系统，是所有生物共同的家园。",
        "食物链的书写有三条规则：第一，起始环节必须是生产者，也就是绿色植物；第二，箭头由被吃者指向捕食者，表示物质和能量沿吃与被吃的方向流动，例如草→兔→狐；第三，链条中不能出现分解者（细菌和真菌），也不能混入阳光、空气、水等非生物部分。检查一条食物链就按这三条逐项过。数食物网中的食物链时，从生产者出发沿箭头走到最高级的消费者，一条一条数，做到不重不漏。给生态成分归类则抓关键问句：能自己制造有机物吗？是植物，生产者；直接或间接以植物为食吗？是动物，消费者；把有机物分解成无机物吗？是细菌真菌，分解者。",
        "易混点逐一辨析：阳光→草→牛不是食物链，起点阳光是非生物部分；鼠→蛇→鹰也不是，起点鼠是消费者；鹰→蛇→青蛙→昆虫方向写反了，箭头必须指向取食者。另一个易错点是自动调节：在一般情况下，生态系统中各种生物的数量和所占的比例是相对稳定的，这说明生态系统具有一定的自动调节能力，但调节能力有一定限度——生态系统的成分越复杂，自动调节能力就越强，一般情况下森林生态系统比草原生态系统的自动调节能力更强一些；可是一旦外界干扰超过限度，例如草场上放养的牲畜太多，草场植被被严重破坏、土地沙化，就很难恢复原样。",
        "生态系统中的物质和能量就是沿着食物链和食物网流动的。当人类排放的有毒物质进入生态系统，有毒物质会通过食物链不断积累，营养级别越高的生物体内积累越多，最终威胁人类自身。往后的学习里，绿色植物通过光合作用制造的有机物和氧气，正是一切食物链的物质和能量源头；理解了这一点，就明白保护植物、保护每一个生态系统，就是在保护我们共同的生物圈。"
      ],
      "methods": [
        {
          "name": "食物链书写与挑错三查法",
          "steps": [
            "一查起点：链条开头必须是生产者（绿色植物），否则错误",
            "二查箭头：每个箭头都从被吃者指向捕食者，方向不能反",
            "三查成分：链条中不能出现分解者（细菌和真菌）和非生物部分（阳光、空气、水）",
            "四复读：顺着箭头把生物连读一遍，确认吃与被吃的关系成立"
          ],
          "tip": "起点植物、箭头指捕食者、不写分解者"
        },
        {
          "name": "生态成分归类四问法",
          "steps": [
            "问能否通过光合作用自己制造有机物：能，是生产者（植物）",
            "问是否直接或间接以植物为食：是，是消费者（动物）",
            "问是否把有机物分解成无机物：是，是分解者（细菌和真菌）",
            "剩下的阳光、空气、水、温度等归入非生物部分"
          ],
          "tip": "植物造、动物吃、菌类分解，光气水是非生物"
        }
      ],
      "examples": [
        {
          "question": "有人为了防止鸟吃草籽儿，把人工种草的试验区用网罩了起来。过一段时间发现，草几乎被虫吃光了，而未加罩网的天然草原，牧草却生长良好。这个实例说明了什么道理？",
          "solution": "说明生物与环境是一个不可分割的整体，各种生物之间相互制约：网罩把鸟隔在外面后，吃草的昆虫失去了鸟的控制，数量猖獗，把草吃光；天然草原上鸟捕食昆虫，控制了昆虫数量，牧草得以正常生长。",
          "difficulty": 2,
          "pitfall": "只答出虫多了草被吃光，没点出「生物与环境不可分割、生物之间相互制约」这一关键结论。"
        },
        {
          "question": "淡水生态系统中有一条食物链：微小的水生植物→剑水蚤→蜻蜓的幼虫→小鱼→大鱼。排入水体的某些有毒物质在生物体内难以分解、无法排出。哪种生物体内积累的有毒物质最多？为什么？",
          "solution": "大鱼体内积累最多。有毒物质沿食物链不断积累，大鱼的营养级别最高，它体内既有从小鱼那里获得的、已经积累的有毒物质，又加上自身新的积累，因此营养级别越高的生物体内有毒物质越多。",
          "difficulty": 2,
          "pitfall": "误以为体型最大或数量最多的生物积累有毒物质多——积累多少看营养级别高低，不看数量。"
        }
      ],
      "mistakes": [
        "食物链的起始环节必须是生产者：写阳光→草→牛→虎错了，阳光是非生物部分；写鼠→蛇→鹰也错了，起点鼠是消费者。",
        "箭头方向不能写反：食物链表示吃与被吃的关系，箭头要指向捕食者（取食者），如草→兔→狐，不能写成狐→兔→草。",
        "食物链中不能出现分解者：细菌和真菌不进入食物链，它们负责把有机物分解成无机物供植物重新利用。",
        "生态系统的自动调节能力有限：不是怎么破坏都能恢复，放养的牲畜太多会严重破坏草场植被，造成土地沙化，草场很难恢复原样。"
      ],
      "source": {
        "unit": "第一单元 生物和生物圈",
        "pages": [
          19,
          32
        ],
        "alignedAt": "2026-10-30"
      },
      "exercises": [
        {
          "kind": "textbook",
          "question": "下列四个选项中，正确表示食物链的是（　）",
          "options": [
            "阳光→草→牛→虎",
            "鼠→蛇→鹰",
            "鹰→蛇→青蛙→昆虫",
            "草→兔→鹰"
          ],
          "answer": "D",
          "solution": "食物链的起始环节必须是生产者，箭头指向捕食者，且不含分解者和非生物部分。A错在起点阳光是非生物部分；B错在起点鼠是消费者；C错在箭头方向反了，应为昆虫→青蛙→蛇→鹰；D起点是草，箭头指向捕食者，正确。",
          "difficulty": 2,
          "source": {
            "label": "人教版七上 P24·练习T2（正确表示食物链的是哪一项）"
          }
        },
        {
          "kind": "textbook",
          "question": "生态系统的组成图解中，生态系统分为生物部分和非生物部分，生物部分包括植物、动物和细菌、真菌。请把这一组成补充完整：写出各生物成分的名称及其在生态系统中的角色，并举例说出非生物部分包括哪些。",
          "answer": "植物是生产者，动物是消费者，细菌和真菌是分解者；非生物部分包括阳光、空气、水等。",
          "solution": "植物能通过光合作用制造有机物，是生产者；动物不能自己制造有机物，直接或间接以植物为食，是消费者；细菌和真菌能把有机物分解成无机物供植物重新利用，是分解者；此外还有阳光、空气、水等非生物部分。",
          "difficulty": 1,
          "source": {
            "label": "人教版七上 P25·练习T5（生态系统组成图解补充）"
          }
        },
        {
          "kind": "variant",
          "question": "在稻田生态系统中存在食物链：水稻→害虫→青蛙。有人为了吃青蛙而大量捕捉野生青蛙，这种做法会产生什么后果？请用食物链和自动调节能力的知识分析。",
          "answer": "青蛙减少后，害虫因失去天敌而大量繁殖，啃食水稻造成减产；外界干扰超过生态系统的自动调节限度，农田生态系统就会遭到破坏。",
          "solution": "在水稻→害虫→青蛙这条食物链中，青蛙捕食害虫；大量捕捉青蛙后，害虫失去天敌控制，数量大增，水稻受害减产；生态系统的自动调节能力有一定限度，人为干扰超过限度，生态系统就会遭到破坏。",
          "difficulty": 2,
          "source": {
            "label": "人教版七上 P24·练习T3（大量捕捉野生青蛙的后果）变式"
          }
        },
        {
          "kind": "extension",
          "question": "农田生态系统以农作物为主体，动植物种类相对较少，农作物抵抗旱、涝或病虫害的能力较差；森林生态系统则动植物种类繁多。结合「生态系统的成分越复杂，自动调节能力越强」，说明为什么种植单一农作物的农田更需要人们精心管理。",
          "answer": "农田生态系统生物种类少、营养结构简单，自动调节能力弱，容易因旱、涝或病虫害而失衡，所以需要人工灌溉、施肥、防治病虫害来维持。",
          "solution": "生态系统的成分越复杂，其自动调节能力就越强；农田生态系统以农作物为主体，动植物种类相对较少，自动调节能力弱，一旦遇到旱、涝或病虫害，各种生物的数量很容易失衡，因此需要在栽培和管理中投入大量人力物力。",
          "difficulty": 3
        }
      ]
    },
    {
      "topicId": "ct_sw_g7a_03",
      "summary": "取镜对光再观察，低倍找像高倍细调；擦滴撕展盖染吸，做张装片看细胞",
      "explanation": [